[
  {
    "accepted": 1,
    "block_height": 546199,
    "domain": "id.blockstack",
    "fully_qualified_subdomain": "nturl345.id.blockstack",
    "missing": "",
    "owner": "17Q8hcsxRLCk3ypJiGeXQv9tFK9GnHr5Ea",
    "parent_zonefile_hash": "58224144791919f6206251a9960a2dd5723b96b6",
    "parent_zonefile_index": 95780,
    "resolver": "https://registrar.blockstack.org",
    "sequence": 0,
    "signature": "None",
    "txid": "d04d708472ea3c147f50e43264efdb1535f71974053126dc4db67b3ac19d41fe",
    "zonefile_hash": "d3bdf1cf010aac3f21fac473e41450f5357e0817",
    "zonefile_offset": 0
  },
  {
    "accepted": 1,
    "block_height": 546199,
    "domain": "id.blockstack",
    "fully_qualified_subdomain": "dwerner1.id.blockstack",
    "missing": "",
    "owner": "17tFeKEBMUAAiHVsCgqKo8ccwYqq7aCn9X",
    "parent_zonefile_hash": "58224144791919f6206251a9960a2dd5723b96b6",
    "parent_zonefile_index": 95780,
    "resolver": "https://registrar.blockstack.org",
    "sequence": 0,
    "signature": "None",
    "txid": "d04d708472ea3c147f50e43264efdb1535f71974053126dc4db67b3ac19d41fe",
    "zonefile_hash": "ab79b1774fa7a4c5709b6ad4e5892fb7c0f79765",
    "zonefile_offset": 1
  }
]
